6,Mrs. Dennis Schulist,False,explicabo enim cumque porro aperiam occaecati minima
6,Mrs. Dennis Schulist,False,sed ab consequatur
6,Mrs. Dennis Schulist,False,non sunt delectus illo nulla tenetur enim omnis
6,Mrs. Dennis Schulist,False,excepturi non laudantium quo
6,Mrs. Dennis Schulist,True,totam quia dolorem et illum repellat voluptas optio
6,Mrs. Dennis Schulist,True,ad illo quis voluptatem temporibus
6,Mrs. Dennis Schulist,False,praesentium facilis omnis laudantium fugit ad iusto nihil nesciunt
6,Mrs. Dennis Schulist,True,a eos eaque nihil et exercitationem incidunt delectus
6,Mrs. Dennis Schulist,True,autem temporibus harum quisquam in culpa
6,Mrs. Dennis Schulist,True,aut aut ea corporis
6,Mrs. Dennis Schulist,False,magni accusantium labore et id quis provident
6,Mrs. Dennis Schulist,False,consectetur impedit quisquam qui deserunt non rerum consequuntur eius
6,Mrs. Dennis Schulist,False,quia atque aliquam sunt impedit voluptatum rerum assumenda nisi
6,Mrs. Dennis Schulist,False,cupiditate quos possimus corporis quisquam exercitationem beatae
6,Mrs. Dennis Schulist,False,sed et ea eum
6,Mrs. Dennis Schulist,True,ipsa dolores vel facilis ut
6,Mrs. Dennis Schulist,False,sequi quae est et qui qui eveniet asperiores
6,Mrs. Dennis Schulist,False,quia modi consequatur vero fugiat
6,Mrs. Dennis Schulist,False,corporis ducimus ea perspiciatis iste
6,Mrs. Dennis Schulist,False,dolorem laboriosam vel voluptas et aliquam quasi
